{
  "generated_at": "2026-09-26T00:00:00Z",
  "input": {
    "format": "mmcif",
    "path": "tests/panel/5FQL.cif.gz",
    "sha256": "ac5ffc6fed697e7b2659f6747ad4d0638eb949220cd7ca7c8c3b372ce183f8d5"
  },
  "knowledge_base": {
    "sha256": "881d25a420103b8b7c775bea95a644cda98e3ca89439fadf129c556e6017ef78",
    "version": "0.5.0"
  },
  "manifest_sha256": "4b92e3abae03715a64ae49eeea0be68f6e5dc737dcb895b19a064bbeb5a2391a",
  "relaxation_protocol": {
    "enabled": true,
    "engine": "openmm",
    "force_field_files": [
      "amber14-all.xml",
      "amber14/tip3p.xml"
    ],
    "hydrogen_ph": 7.0,
    "max_iterations": 5000,
    "mobile_atoms": "side_chains_and_waters",
    "mobile_shell_angstrom": 6.0,
    "nonbonded_cutoff_nm": 1.0,
    "platform": "Reference",
    "restraint_kj_per_mol_nm2": 10000.0,
    "seed": 20260926,
    "tolerance_kj_per_mol_nm": 1.0
  },
  "relaxed_wild_types": [
    {
      "counts": [
        {
          "added": 0,
          "excluded": 0,
          "in": 507,
          "modified": 24,
          "out": 507,
          "passed_through": 483,
          "record_type": "polymer residues"
        },
        {
          "added": 0,
          "excluded": 0,
          "in": 4,
          "modified": 0,
          "out": 4,
          "passed_through": 4,
          "record_type": "nonpolymer residues"
        },
        {
          "added": 0,
          "excluded": 0,
          "in": 0,
          "modified": 0,
          "out": 0,
          "passed_through": 0,
          "record_type": "branched residues"
        },
        {
          "added": 0,
          "excluded": 0,
          "in": 213,
          "modified": 5,
          "out": 213,
          "passed_through": 208,
          "record_type": "water residues"
        },
        {
          "added": 0,
          "excluded": 179,
          "in": 8158,
          "modified": 196,
          "out": 7979,
          "passed_through": 7783,
          "record_type": "atom records"
        },
        {
          "added": 0,
          "excluded": 0,
          "in": 11,
          "modified": 0,
          "out": 11,
          "passed_through": 11,
          "record_type": "struct_conn records"
        },
        {
          "added": 0,
          "excluded": 0,
          "in": 8,
          "modified": 0,
          "out": 8,
          "passed_through": 8,
          "record_type": "pdbx_struct_mod_residue records"
        },
        {
          "added": 0,
          "excluded": 0,
          "in": 18,
          "modified": 0,
          "out": 18,
          "passed_through": 18,
          "record_type": "unobserved polymer residues (annotation)"
        }
      ],
      "directory": "wt_relaxed_A468",
      "files": [
        {
          "format": "mmcif",
          "path": "system.cif",
          "sha256": "75ce97caf1763e5fb3d43667499870b343472fd7b21f59857692b307a749f023"
        },
        {
          "format": "pdb",
          "path": "system.pdb",
          "sha256": "d39dd7269e34da3e78b1e218952f557357d0d249f9bdaf6c6166b05df7cced06"
        }
      ],
      "findings": [],
      "name": "wt_relaxed_A468",
      "relaxation": {
        "clashes_after": 0,
        "clashes_before": 0,
        "energy_kj_per_mol": {
          "final": 243603.7,
          "initial": 250667.8,
          "note": "Total potential energy of the calculation, dominated by fixed-fixed terms; not comparable between systems. Only the change and the final force on mobile atoms are meaningful."
        },
        "frozen": [
          {
            "chain": "A",
            "distance_angstrom": 5.07,
            "ins_code": "",
            "near": "ALS A:84",
            "seq_num": 348
          },
          {
            "chain": "A",
            "distance_angstrom": 6.76,
            "ins_code": "",
            "near": "ALS A:84",
            "seq_num": 466
          },
          {
            "chain": "A",
            "distance_angstrom": 9.29,
            "ins_code": "",
            "near": "ALS A:84",
            "seq_num": 478
          },
          {
            "chain": "A",
            "distance_angstrom": 3.85,
            "ins_code": "",
            "near": "ALS A:84",
            "seq_num": 479
          }
        ],
        "left_out": [
          {
            "chain": "A",
            "distance_angstrom": 10.18,
            "ins_code": "",
            "res_name": "ALS",
            "seq_num": 84
          },
          {
            "chain": "A",
            "distance_angstrom": 12.51,
            "ins_code": "",
            "res_name": "CA",
            "seq_num": 1551
          },
          {
            "chain": "A",
            "distance_angstrom": 23.07,
            "ins_code": "",
            "res_name": "CL",
            "seq_num": 1567
          },
          {
            "chain": "A",
            "distance_angstrom": 28.59,
            "ins_code": "",
            "res_name": "CL",
            "seq_num": 1568
          },
          {
            "chain": "A",
            "distance_angstrom": 15.91,
            "ins_code": "",
            "res_name": "CL",
            "seq_num": 1569
          }
        ],
        "max_displacement_angstrom": 0.438,
        "max_mobile_force_kj_per_mol_nm": 20.76,
        "mobile_atoms": 100,
        "moved_atoms": 100,
        "moved_residues": [
          {
            "chain": "A",
            "ins_code": "",
            "seq_num": 261
          },
          {
            "chain": "A",
            "ins_code": "",
            "seq_num": 262
          },
          {
            "chain": "A",
            "ins_code": "",
            "seq_num": 263
          },
          {
            "chain": "A",
            "ins_code": "",
            "seq_num": 264
          },
          {
            "chain": "A",
            "ins_code": "",
            "seq_num": 265
          },
          {
            "chain": "A",
            "ins_code": "",
            "seq_num": 266
          },
          {
            "chain": "A",
            "ins_code": "",
            "seq_num": 344
          },
          {
            "chain": "A",
            "ins_code": "",
            "seq_num": 349
          },
          {
            "chain": "A",
            "ins_code": "",
            "seq_num": 350
          },
          {
            "chain": "A",
            "ins_code": "",
            "seq_num": 467
          },
          {
            "chain": "A",
            "ins_code": "",
            "seq_num": 468
          },
          {
            "chain": "A",
            "ins_code": "",
            "seq_num": 469
          },
          {
            "chain": "A",
            "ins_code": "",
            "seq_num": 470
          },
          {
            "chain": "A",
            "ins_code": "",
            "seq_num": 471
          },
          {
            "chain": "A",
            "ins_code": "",
            "seq_num": 473
          },
          {
            "chain": "A",
            "ins_code": "",
            "seq_num": 476
          },
          {
            "chain": "A",
            "ins_code": "",
            "seq_num": 477
          },
          {
            "chain": "A",
            "ins_code": "",
            "seq_num": 480
          },
          {
            "chain": "A",
            "ins_code": "",
            "seq_num": 484
          },
          {
            "chain": "A",
            "ins_code": "",
            "seq_num": 485
          },
          {
            "chain": "A",
            "ins_code": "",
            "seq_num": 486
          },
          {
            "chain": "A",
            "ins_code": "",
            "seq_num": 487
          },
          {
            "chain": "A",
            "ins_code": "",
            "seq_num": 488
          },
          {
            "chain": "A",
            "ins_code": "",
            "seq_num": 502
          },
          {
            "chain": "A",
            "ins_code": "",
            "seq_num": 2125
          },
          {
            "chain": "A",
            "ins_code": "",
            "seq_num": 2126
          },
          {
            "chain": "A",
            "ins_code": "",
            "seq_num": 2127
          },
          {
            "chain": "A",
            "ins_code": "",
            "seq_num": 2183
          },
          {
            "chain": "A",
            "ins_code": "",
            "seq_num": 2184
          }
        ],
        "openmm_version": "8.6.1",
        "rms_displacement_angstrom": 0.13,
        "shell_residues": 34,
        "sites": [
          {
            "chain": "A",
            "ins_code": "",
            "seq_num": 468
          }
        ]
      },
      "sites": [
        {
          "chain": "A",
          "ins_code": "",
          "seq_num": 468
        }
      ],
      "work_order": [
        {
          "description": "Nonbonded 12-6-4 LJ-type ion model: CA site A:1551: likely_catalytic, coordination number 6",
          "finding_id": "metals/A:1551",
          "option_id": "nonbonded_12_6_4",
          "residues": [
            {
              "chain": "A",
              "ins_code": "",
              "seq_num": 1551
            }
          ],
          "stage": "parameterization"
        },
        {
          "description": "Model FGly as the aldehyde hydrate (gem-diol, FGH): Formylglycine (sulfatase catalytic residue): ALS A:84",
          "finding_id": "nonstandard_residues/A:84",
          "option_id": "model_gem_diol",
          "residues": [
            {
              "chain": "A",
              "ins_code": "",
              "seq_num": 84
            }
          ],
          "stage": "chemistry"
        },
        {
          "description": "Cap the first/last observed residue (neutral ACE/NME-style caps): Unobserved N-terminal residues: A:26-33 (8 residues)",
          "finding_id": "missing_residues/A:26-33",
          "option_id": "cap_termini",
          "residues": [
            {
              "chain": "A",
              "ins_code": "",